{
  "schema_version": "job-skill-shelver-298-safety-technical-review-result-v1",
  "result_id": "job-skill-shelver-298-safety-technical-review-2026-07-19",
  "status": "VALIDATED_MACHINE_AUTHORITY",
  "reviewer": {
    "name": "赫东",
    "reviewed_date": "2026-07-19"
  },
  "scope": {
    "source_total": 298,
    "excluded_pilot_source_total": 24,
    "reviewed_total": 274
  },
  "source_files": [
    {
      "path": "doc/features/job-skill-shelver-298-safety-technical-review-result-2026-07-19.md",
      "sha256": "sha256:da30b736c613630ab58fe403cc3f571844fcabdd10b7699bb23f0f99f350eb1e"
    },
    {
      "path": "doc/features/job-skill-shelver-298-question-content-review-packet-remaining-274-v1.md",
      "sha256": "sha256:0e0ecff42485c7c97db2eb72a0b0036f3b56dea1854c4e0cf2da5af304bcda87"
    },
    {
      "path": "doc/reference/专业岗位能力测评题库-M1-M6-数据库导出-298条.json",
      "sha256": "sha256:7af29b8ab55edfa07f5931fce4721a6777fbf0f5d0f9d68e7028ac8228f4bc98"
    }
  ],
  "generated_at": "2026-07-20T00:00:00+08:00",
  "summary": {
    "total": 274,
    "safety_pass": 236,
    "safety_return_for_revision": 38,
    "technical_pass": 203,
    "technical_return_for_revision": 71,
    "both_pass": 197,
    "safety_return_technical_pass": 6,
    "safety_pass_technical_return": 39,
    "both_return": 32
  },
  "questions": [
    {
      "question_id": "M1_DG_027",
      "question_version": 1,
      "source_record_hash": "sha256:44f8bd2e417680cff865064b31b1b4038ff636df0aa72e75840dbd0ffe9c8d06",
      "safety_conclusion": "PASS",
      "safety_note": "按题设正确答案或达标行为执行，未发现会直接造成员工、顾客、现场或商品安全风险的操作指引。",
      "technical_conclusion": "PASS",
      "technical_note": "答案体现商品名称、规格、条码或货位与价签对应核验，发现错签后采取上报、撤下或更换复核流程。",
      "activation_recommendation": "NEXT_GATE_ELIGIBLE",
      "minimum_re_review_requirement": null,
      "reviewer": "赫东",
      "reviewed_date": "2026-07-19",
      "source_file": "doc/features/job-skill-shelver-298-safety-technical-review-result-2026-07-19.md"
    },
    {
      "question_id": "M1_DG_028",
      "question_version": 1,
      "source_record_hash": "sha256:c710ec3c94ce88eaef74e6854634720e1101a10ecc80a39342139145d4538761",
      "safety_conclusion": "RETURN_FOR_REVISION",
      "safety_note": "将“酸奶”直接归入普通饮品区，可能脱离冷藏条件，存在商品温控和食品安全风险；应明确为常温酸奶，或改入冷藏区。",
      "technical_conclusion": "RETURN_FOR_REVISION",
      "technical_note": "商品分区错误或条件不足：普通酸奶通常属于冷藏商品，不能与可乐统一归入常温饮品区。",
      "activation_recommendation": "RETURN_FOR_REVISION",
      "minimum_re_review_requirement": "先消除安全风险并补齐必要工具、边界或应急步骤；修正标准答案、岗位流程、素材条件或评分锚点，生成新版本与新 hash 后重新提交。",
      "reviewer": "赫东",
      "reviewed_date": "2026-07-19",
      "source_file": "doc/features/job-skill-shelver-298-safety-technical-review-result-2026-07-19.md"
    },
    {
      "question_id": "M1_DG_029",
      "question_version": 1,
      "source_record_hash": "sha256:96b520aa86398c082f2ed3f24bd29ae183899c53effa2bd2bf2ba8b871be0ddb",
      "safety_conclusion": "PASS",
      "safety_note": "标准答案体现重物低位存放或规范搬运原则，未引导高位堆放、单人强搬或不稳定摆放。",
      "technical_conclusion": "PASS",
      "technical_note": "答案符合货架稳定与陈列原则：重物低位、轻小件高位，并兼顾层板承重、商品稳定和取放便利。",
      "activation_recommendation": "NEXT_GATE_ELIGIBLE",
      "minimum_re_review_requirement": null,
      "reviewer": "赫东",
      "reviewed_date": "2026-07-19",
      "source_file": "doc/features/job-skill-shelver-298-safety-technical-review-result-2026-07-19.md"
    },
    {
      "question_id": "M1_DG_030",
      "question_version": 1,
      "source_record_hash": "sha256:eda41b571538d19e333fc3fbaae305a08ad356187351a2883a26080bffa73773",
      "safety_conclusion": "PASS",
      "safety_note": "按题设正确答案或达标行为执行，未发现会直接造成员工、顾客、现场或商品安全风险的操作指引。",
      "technical_conclusion": "PASS",
      "technical_note": "答案体现商品名称、规格、条码或货位与价签对应核验，发现错签后采取上报、撤下或更换复核流程。",
      "activation_recommendation": "NEXT_GATE_ELIGIBLE",
      "minimum_re_review_requirement": null,
      "reviewer": "赫东",
      "reviewed_date": "2026-07-19",
      "source_file": "doc/features/job-skill-shelver-298-safety-technical-review-result-2026-07-19.md"
    },
    {
      "question_id": "M1_DG_031",
      "question_version": 1,
      "source_record_hash": "sha256:74375df41219a8d5e6d95ce27dbb133a3dc87fac2369766b25abd20da4779dcb",
      "safety_conclusion": "PASS",
      "safety_note": "标准答案要求保持通道、消防设施或作业区域畅通，能够避免绊倒、碰撞和疏散受阻风险。",
      "technical_conclusion": "PASS",
      "technical_note": "答案体现商品名称、规格、条码或货位与价签对应核验，发现错签后采取上报、撤下或更换复核流程。",
      "activation_recommendation": "NEXT_GATE_ELIGIBLE",
      "minimum_re_review_requirement": null,
      "reviewer": "赫东",
      "reviewed_date": "2026-07-19",
      "source_file": "doc/features/job-skill-shelver-298-safety-technical-review-result-2026-07-19.md"
    },
    {
      "question_id": "M1_DG_032",
      "question_version": 1,
      "source_record_hash": "sha256:a37858e06b7fdcbf4d2682b068cce062f3e343be28c878cc8cd4ab5cbb36050f",
      "safety_conclusion": "PASS",
      "safety_note": "按题设正确答案或达标行为执行，未发现会直接造成员工、顾客、现场或商品安全风险的操作指引。",
      "technical_conclusion": "PASS",
      "technical_note": "答案能够识别包装完整性异常，并要求停止直接上架、隔离或上报，符合异常商品处理流程。",
      "activation_recommendation": "NEXT_GATE_ELIGIBLE",
      "minimum_re_review_requirement": null,
      "reviewer": "赫东",
      "reviewed_date": "2026-07-19",
      "source_file": "doc/features/job-skill-shelver-298-safety-technical-review-result-2026-07-19.md"
    },
    {
      "question_id": "M1_OB_048",
      "question_version": 1,
      "source_record_hash": "sha256:53ed79790601f597f0dcfa9ba3e5759a7a7c6a63bd7a4dc80bf68f6f42d74ce3",
      "safety_conclusion": "RETURN_FOR_REVISION",
      "safety_note": "评估员故意制造含液体的倒瓶场景会形成真实滑倒风险；即使液量少，也不应采用未预告的湿滑诱发。",
      "technical_conclusion": "RETURN_FOR_REVISION",
      "technical_note": "该任务是隐蔽的亲社会反应观察，不是理货员标准操作流程，且明确“不计分”，不适合作为可激活岗位题。",
      "activation_recommendation": "RETURN_FOR_REVISION",
      "minimum_re_review_requirement": "先消除安全风险并补齐必要工具、边界或应急步骤；修正标准答案、岗位流程、素材条件或评分锚点，生成新版本与新 hash 后重新提交。",
      "reviewer": "赫东",
      "reviewed_date": "2026-07-19",
      "source_file": "doc/features/job-skill-shelver-298-safety-technical-review-result-2026-07-19.md"
    },
    {
      "question_id": "M1_OP_034",
      "question_version": 1,
      "source_record_hash": "sha256:3a0e22dc7be9ebbbee0f125b1be71c6bafe45563e20447c0248cec3c7ab610c8",
      "safety_conclusion": "PASS",
      "safety_note": "按题设正确答案或达标行为执行，未发现会直接造成员工、顾客、现场或商品安全风险的操作指引。",
      "technical_conclusion": "PASS",
      "technical_note": "答案体现商品名称、规格、条码或货位与价签对应核验，发现错签后采取上报、撤下或更换复核流程。",
      "activation_recommendation": "NEXT_GATE_ELIGIBLE",
      "minimum_re_review_requirement": null,
      "reviewer": "赫东",
      "reviewed_date": "2026-07-19",
      "source_file": "doc/features/job-skill-shelver-298-safety-technical-review-result-2026-07-19.md"
    },
    {
      "question_id": "M1_OP_035",
      "question_version": 1,
      "source_record_hash": "sha256:c83daf3256f0593d7f10433bcd3d09333d3ca572dab7dcb83f957f16370b3f8a",
      "safety_conclusion": "PASS",
      "safety_note": "按题设正确答案或达标行为执行，未发现会直接造成员工、顾客、现场或商品安全风险的操作指引。",
      "technical_conclusion": "PASS",
      "technical_note": "答案符合基础陈列要求：商品扶正、正面朝外、排面规整并保持价签可见。",
      "activation_recommendation": "NEXT_GATE_ELIGIBLE",
      "minimum_re_review_requirement": null,
      "reviewer": "赫东",
      "reviewed_date": "2026-07-19",
      "source_file": "doc/features/job-skill-shelver-298-safety-technical-review-result-2026-07-19.md"
    },
    {
      "question_id": "M1_OP_036",
      "question_version": 1,
      "source_record_hash": "sha256:5afee81fb48dedded06e7a1a802e8fd751f866620eb00bdc16acc90fe18bf68a",
      "safety_conclusion": "PASS",
      "safety_note": "按题设正确答案或达标行为执行，未发现会直接造成员工、顾客、现场或商品安全风险的操作指引。",
      "technical_conclusion": "PASS",
      "technical_note": "答案体现商品名称、规格、条码或货位与价签对应核验，发现错签后采取上报、撤下或更换复核流程。",
      "activation_recommendation": "NEXT_GATE_ELIGIBLE",
      "minimum_re_review_requirement": null,
      "reviewer": "赫东",
      "reviewed_date": "2026-07-19",
      "source_file": "doc/features/job-skill-shelver-298-safety-technical-review-result-2026-07-19.md"
    },
    {
      "question_id": "M1_OP_037",
      "question_version": 1,
      "source_record_hash": "sha256:f72105b5a40fc6161edce43c0915894b2d5d0129d74720d738a792f9615beb27",
      "safety_conclusion": "PASS",
      "safety_note": "按题设正确答案或达标行为执行，未发现会直接造成员工、顾客、现场或商品安全风险的操作指引。",
      "technical_conclusion": "RETURN_FOR_REVISION",
      "technical_note": "“同类商品从大到小排列”不是通用陈列标准；真实门店应按陈列图、SKU、品牌块、规格和价签位置执行。",
      "activation_recommendation": "RETURN_FOR_REVISION",
      "minimum_re_review_requirement": "修正标准答案、岗位流程、素材条件或评分锚点，生成新版本与新 hash 后重新提交。",
      "reviewer": "赫东",
      "reviewed_date": "2026-07-19",
      "source_file": "doc/features/job-skill-shelver-298-safety-technical-review-result-2026-07-19.md"
    },
    {
      "question_id": "M1_OP_038",
      "question_version": 1,
      "source_record_hash": "sha256:91b69895d4170db0980c111ff7c48038279e2597fafef46d6fe27e8dd704a111",
      "safety_conclusion": "RETURN_FOR_REVISION",
      "safety_note": "未限定污渍性质、是否先移开商品、是否使用批准清洁剂及警示措施，可能造成污染、湿滑或商品受损。",
      "technical_conclusion": "RETURN_FOR_REVISION",
      "technical_note": "清洁流程和评分锚点过于简化，仅以“无明显污渍”判定，缺少移货、隔离、清洁、干燥、复位和复查步骤。",
      "activation_recommendation": "RETURN_FOR_REVISION",
      "minimum_re_review_requirement": "先消除安全风险并补齐必要工具、边界或应急步骤；修正标准答案、岗位流程、素材条件或评分锚点，生成新版本与新 hash 后重新提交。",
      "reviewer": "赫东",
      "reviewed_date": "2026-07-19",
      "source_file": "doc/features/job-skill-shelver-298-safety-technical-review-result-2026-07-19.md"
    },
    {
      "question_id": "M1_OP_039",
      "question_version": 1,
      "source_record_hash": "sha256:da9b4e8ab578f36606dcbc9c4d03a847d0abc3d9ae2c9263e0022c34e9d11688",
      "safety_conclusion": "PASS",
      "safety_note": "按题设正确答案或达标行为执行，未发现会直接造成员工、顾客、现场或商品安全风险的操作指引。",
      "technical_conclusion": "RETURN_FOR_REVISION",
      "technical_note": "仅凭“错位”移动价签不足以完成真实核对；应先核对条码、品名、规格和价格，再按权限归位或上报。",